Topic ID,Top Keywords,Dominant Papers,Topic Label
0,"land, environmental, soil, crop, resource, production, water, demand, increased, mitigation, expansion, trade, environmental_impact, agriculture, future",17,Land / Soil / Water
1,"household, determinant, income, education, rural_household, status, availability, farm_household, ethiopia, rural, livelihood, factor, regression, result, offfarm",17,Household Determinants
2,"loss, postharvest_loss, fruit_vegetable, postharvest, grain, appropriate, storage, stage, due, practice, quality, supply_chain, grain_storage, process, product",15,Post-Harvest Loss & Storage
3,"climate_change, adaptation_strategy, adaptation, impact, change, climate, farmer, yield, rainfall, temperature, ethiopia, crop, implication, affect, productivity",16,Climate Change Adaptation
4,"rice, yield, variety, silo, wheat, grain, crop, temperature, sahbhagi_dhan, region, asia, past, domestic, price, value_chain",7,Grain Variety & Temperature
5,"technology, adoption, farmer, storage, investment, improved, phl, sensor, postharvest, increased, nigeria, agricultural, sap, program, method",15,Technology & Storage Adoption
6,"africa, economic, production, system, waste, smallholder, value_chain, investment, social, people, institutional, better, driver, sector, especially",27,Africa: Value Chain & Investment
